2016/02/25,23:34:27.946Z,I always think what would Jesus do? We should follow his example be the good Samaritan and help these people out. As a rich Western nation it's time for us to give something back to the rest of the world. ,Hull United Kingdom,-231,263,Greece warns it won&#x26;#8217;t be &#x26;#8216;warehouse of souls&#x26;#8217; as desperate migrants try to hang themselves in Athens square after neighbouring countries shut their borders
2016/02/25,23:33:07.211Z,Very sad but emotional blackmail can't force the impossible.,Cambridge United Kingdom,335,351,Greece warns it won&#x26;#8217;t be &#x26;#8216;warehouse of souls&#x26;#8217; as desperate migrants try to hang themselves in Athens square after neighbouring countries shut their borders
2016/02/25,23:27:12.744Z,Why are there Pakistan men trying to get on the bandwagon  what's going on in the East!,Driffield,437,445,Greece warns it won&#x26;#8217;t be &#x26;#8216;warehouse of souls&#x26;#8217; as desperate migrants try to hang themselves in Athens square after neighbouring countries shut their borders
2016/02/25,22:57:46.125Z,Refugees from Pakistan?  Refugees from what exactly???,Kansas United States,555,563,Greece warns it won&#x26;#8217;t be &#x26;#8216;warehouse of souls&#x26;#8217; as desperate migrants try to hang themselves in Athens square after neighbouring countries shut their borders
2016/02/25,22:53:16.351Z,We have to stay in the EU and face this problem together offer them housing and jobs that is what we do in Britain we pull together and embrace change,Southampton United Kingdom,-1044,1160,Greece warns it won&#x26;#8217;t be &#x26;#8216;warehouse of souls&#x26;#8217; as desperate migrants try to hang themselves in Athens square after neighbouring countries shut their borders
2016/02/25,22:50:46.516Z,How many more lives will be lost until the governments and people of Western Europe open their hearts and homes as the wise Diane Abbott said earlier "This is not a refugee crisis it is a crisis of Western Europe failing to meet its moral responsibility" ,Arica Chile,-1005,1147,Greece warns it won&#x26;#8217;t be &#x26;#8216;warehouse of souls&#x26;#8217; as desperate migrants try to hang themselves in Athens square after neighbouring countries shut their borders
2016/02/25,22:48:16.394Z,Britain should take them in! Help out the struggling Greeks and the helpless refugees. It's the compassionate thing to do!,Shoreditch United Kingdom,-927,1013,Greece warns it won&#x26;#8217;t be &#x26;#8216;warehouse of souls&#x26;#8217; as desperate migrants try to hang themselves in Athens square after neighbouring countries shut their borders
2016/02/25,22:45:53.705Z,this is what europe has been reduced to in closing our borders just look at it hopefully some of you will change your minds,Kansas Texas United Kingdom,-743,783,Greece warns it won&#x26;#8217;t be &#x26;#8216;warehouse of souls&#x26;#8217; as desperate migrants try to hang themselves in Athens square after neighbouring countries shut their borders
2016/02/25,22:41:49.490Z,I have a good idea. 1st step is to vote us in to the EU. 2nd step is to kick Greece out of EU because they have no compassion. 3rd step is to migrate the refugees across the truly caring EU countries. 4th step is just a step closer to global harmony.,London United Kingdom,-766,794,Greece warns it won&#x26;#8217;t be &#x26;#8216;warehouse of souls&#x26;#8217; as desperate migrants try to hang themselves in Athens square after neighbouring countries shut their borders
2016/02/25,22:39:45.919Z,If we don't help these poor souls then we are simply signing their death warrants. Greece don't seem to care. We are Britain. We are different. We hold ourselves to a higher standard. We have to set an example and help these people. We must build them homes. Let them become our neighbours. We must embrace them into British society. Come home to Britain poor refugees,London United Kingdom,-824,872,Greece warns it won&#x26;#8217;t be &#x26;#8216;warehouse of souls&#x26;#8217; as desperate migrants try to hang themselves in Athens square after neighbouring countries shut their borders
2016/02/25,22:39:12.470Z,Shocking - Time for Britian to play our part in helping out this crisis - and take our share of these refugees.  ,London United Kingdom,-833,893,Greece warns it won&#x26;#8217;t be &#x26;#8216;warehouse of souls&#x26;#8217; as desperate migrants try to hang themselves in Athens square after neighbouring countries shut their borders
